,0
https://en.wikipedia.org/wiki/Machine_Learning_(journal),"Machine Learning  is a peer-reviewed scientific journal, published since 1986.
It should be distinguished from the journal Machine intelligence which was established in the mid-1960s.[1]
In 2001, forty editors and members of the editorial board of Machine Learning resigned in order to support the Journal of Machine Learning Research (JMLR), saying that in the era of the internet, it was detrimental for researchers to continue publishing their papers in expensive journals with pay-access archives. Instead, they wrote, they supported the model of JMLR, in which authors retained copyright over their papers and archives were freely available on the internet.[2]
Following the mass resignation, Kluwer changed their publishing policy to allow authors to self-archive their papers online after peer-review.[3]

"
